raw_content,cleaned_content
为小镜子反射的光点发狂，被水上的漂浮小球救起。狐猴在四处搜罗，鹭鹰在争夺领地，野犬在到处狂吠，水豚在安然休憩。末日里的小动物们在努力求生，从陆地换成方舟不过是另一种栖居。到山顶去看天，到水底去赏鱼，会有孤鸟在船尾把持方向，会有巨鲸从海底拯救万灵。洪水吞没人类文明，留下希声的遗迹。,为小镜子反射的光点发狂 被水上的漂浮小球救起 狐猴在四处搜罗 鹭鹰在争夺领地 野犬在到处狂吠 水豚在安然休憩 末日里的小动物们在努力求生 从陆地换成方舟不过是另一种栖居 到山顶去看天 到水底去赏鱼 会有孤鸟在船尾把持方向 会有巨鲸从海底拯救万灵 洪水吞没人类文明 留下希声的遗迹
猫猫是intp，白鸟是infj，金毛是enfp，狐猴是esfj，卡皮巴拉是rest,猫猫是intp 白鸟是infj 金毛是enfp 狐猴是esfj 卡皮巴拉是rest
影片是厌人症患者的福音，但讽刺的是影院里叽叽喳喳的幼童又扰乱了这一切。,影片是厌人症患者的福音 但讽刺的是影院里叽叽喳喳的幼童又扰乱了这一切
抱着我喵看的，它没坚持多久，可能因为我一直在说看看人家，看看人家,抱着我喵看的 它没坚持多久 可能因为我一直在说看看人家 看看人家
洪水对猫来说是灾难，干旱对鱼来说是灾难。万物共生，潮涨潮落，猫学会了自我献祭，却看不懂天道轮回。真的是一部非常奇妙的电影，简单的寓言却饱含深意，像极了我们的人生。入选年度前十,洪水对猫来说是灾难 干旱对鱼来说是灾难 万物共生 潮涨潮落 猫学会了自我献祭 却看不懂天道轮回 真的是一部非常奇妙的电影 简单的寓言却饱含深意 像极了我们的人生 入选年度前十
有意思，不会因为我们是同类就真的是同类。每个人都有自己的人生课题，独立并不意味着孤独，合作也并不意味着同流。有些人只能一起走一段，也有些人会随时离开。充满哲思的flow。,有意思 不会因为我们是同类就真的是同类 每个人都有自己的人生课题 独立并不意味着孤独 合作也并不意味着同流 有些人只能一起走一段 也有些人会随时离开 充满哲思的flow
某些神性瞬间：鹫羽化成仙，鲸搁浅陆地。,某些神性瞬间 鹫羽化成仙 鲸搁浅陆地
"3.5；以人类痕迹几乎已消除的大洪水时期为背景，透过一只猫的视角，去目睹大地变形、日月变色，画面绝美，动画形式的长镜头如入无人之境（整体框架有游戏的闯关设定），落入深海的幽闭恐惧症爆发。
五种不同性格/意识的动物集结于诺亚方舟，朝着天际线方向的山巅进发——可隐喻为寻找文明和生息的历程，期间更遭遇过狗群上船后的地盘抢夺，但导演并未往这个方向深挖，点到为止后重点落到动物们自我意识的觉醒并为共存共生而作出努力，可能这才是“陆上行舟”坠落之后它们看向水中影子的共同想法，而曾是水中世界守护者的鲸鱼，承载着从濒临死亡而复生的希望，游向开阔明朗的应许之地。
最爱白鹭羽化登仙一段，迷离如梦境，动物群体中最具反叛意识的先行者，必将最先获得自由；而留在尘世的猫猫，成长为智慧和勇气的生灵。",3 5 以人类痕迹几乎已消除的大洪水时期为背景 透过一只猫的视角 去目睹大地变形 日月变色 画面绝美 动画形式的长镜头如入无人之境 整体框架有游戏的闯关设定 落入深海的幽闭恐惧症爆发 五种不同性格 意识的动物集结于诺亚方舟 朝着天际线方向的山巅进发 可隐喻为寻找文明和生息的历程 期间更遭遇过狗群上船后的地盘抢夺 但导演并未往这个方向深挖 点到为止后重点落到动物们自我意识的觉醒并为共存共生而作出努力 可能这才是 陆上行舟 坠落之后它们看向水中影子的共同想法 而曾是水中世界守护者的鲸鱼 承载着从濒临死亡而复生的希望 游向开阔明朗的应许之地 最爱白鹭羽化登仙一段 迷离如梦境 动物群体中最具反叛意识的先行者 必将最先获得自由 而留在尘世的猫猫 成长为智慧和勇气的生灵
边看边怕他们饿着,边看边怕他们饿着
没朋友，找朋友，丢朋友，好朋友。,没朋友 找朋友 丢朋友 好朋友
大虐！大虐！狗狗身败名裂！,大虐 大虐 狗狗身败名裂
导演真是精神东方人。白鸟和鲸鱼的设定好庄子啊。北冥有鱼，其名为鲲。鲲之大，不知其几千里也。化而为鸟，其名为鹏。鹏之背，不知其几千里也。白鸟羽化补天，一鲸落万物生。,导演真是精神东方人 白鸟和鲸鱼的设定好庄子啊 北冥有鱼 其名为鲲 鲲之大 不知其几千里也 化而为鸟 其名为鹏 鹏之背 不知其几千里也 白鸟羽化补天 一鲸落万物生
"没有人类，没有对白，只有动物们在洪水吞没的世界里寻找新的栖息方式。在危险与静谧中，有神性升腾而起。西方的城市、东方的庙宇，还有那些高耸入云的山峦，让人分不清时空。独立而充满戒备的猫，乐观无戒心的狗，处乱不惊的水豚，圣洁又孤傲的蛇鹫，以及那只有收集癖的狐猴，它想靠奇珍异宝吸引同类，但实则不过是举着镜子孤芳自赏——像极了困在社交媒体中的人。

这显然是个可做各种解读的隐喻文本，后疫情、环保主义、移民……总之关于如何被迫与他者找到和谐共处的方式。但也可做最单纯的观看，它仅仅关于一个后人类世界，动物们如何从“大逃杀”想象中生还，重新回到自然之中。水是天劫，也是孕育重生的母体。",没有人类 没有对白 只有动物们在洪水吞没的世界里寻找新的栖息方式 在危险与静谧中 有神性升腾而起 西方的城市 东方的庙宇 还有那些高耸入云的山峦 让人分不清时空 独立而充满戒备的猫 乐观无戒心的狗 处乱不惊的水豚 圣洁又孤傲的蛇鹫 以及那只有收集癖的狐猴 它想靠奇珍异宝吸引同类 但实则不过是举着镜子孤芳自赏 像极了困在社交媒体中的人 这显然是个可做各种解读的隐喻文本 后疫情 环保主义 移民 总之关于如何被迫与他者找到和谐共处的方式 但也可做最单纯的观看 它仅仅关于一个后人类世界 动物们如何从 大逃杀 想象中生还 重新回到自然之中 水是天劫 也是孕育重生的母体
毛的质感在鸟类上很不错，但是主角猫猫狗狗上反而不太好。风格奇幻迤逦，不过故事感很弱。适合放在VR眼镜里做沉浸式短片，不太像电影,毛的质感在鸟类上很不错 但是主角猫猫狗狗上反而不太好 风格奇幻迤逦 不过故事感很弱 适合放在VR眼镜里做沉浸式短片 不太像电影
诺亚方舟，末世寓言。如果你是没有什么坏心眼的小猫咪🐈‍⬛，全世界都会帮你❤️。每种动物的特性都抓得极准，很难不爱！/ SIFF 2024 第4场@美罗城,诺亚方舟 末世寓言 如果你是没有什么坏心眼的小猫咪 全世界都会帮你 每种动物的特性都抓得极准 很难不爱 SIFF 2024 第4场 美罗城
可能是我缺乏点对哲学与萌物的感悟，全片看完的感触只是一丝淡淡的疑惑：这是在做什么？,可能是我缺乏点对哲学与萌物的感悟 全片看完的感触只是一丝淡淡的疑惑 这是在做什么
大洪水之后人类都死绝了吧。就…可不可以不要在小动物身上投射一整套人类社会的生存法则和价值观，真的不想做阅读理解。你们人类太容易自作多情了！,大洪水之后人类都死绝了吧 就 可不可以不要在小动物身上投射一整套人类社会的生存法则和价值观 真的不想做阅读理解 你们人类太容易自作多情了
猫好！卡皮巴拉好！长腿鸟好！狗好！狐猴好！鲲好！喵的一声，猫学会了游泳；喵的一声，猫学会了捉鱼。人做出这样的片子，人也好。,猫好 卡皮巴拉好 长腿鸟好 狗好 狐猴好 鲲好 喵的一声 猫学会了游泳 喵的一声 猫学会了捉鱼 人做出这样的片子 人也好
好温柔、好有爱的动画作品啊,好温柔 好有爱的动画作品啊
额有猫一族表示不如看自家猫治愈，因为动作习性等等都存在不合理的地方，导致无法入戏，无法理解创作初衷，整体的欣赏欲望就被不信任感冲垮了。,额有猫一族表示不如看自家猫治愈 因为动作习性等等都存在不合理的地方 导致无法入戏 无法理解创作初衷 整体的欣赏欲望就被不信任感冲垮了
"想不到一部电影给我看的晕3D了，建模太粗糙，光影也很奇怪，就像玩低画质低帧数游戏一样。去厕所呕了一下才舒服。
大洪水元素的寓言故事，由于没有人类，那就注定了动物拟人化，虽然没有说话，但是动物本身的拟人化行为就代表着本质上还是一群不同人类的在面对灾难时的各种面貌，换成真人没太多不同。",想不到一部电影给我看的晕3D了 建模太粗糙 光影也很奇怪 就像玩低画质低帧数游戏一样 去厕所呕了一下才舒服 大洪水元素的寓言故事 由于没有人类 那就注定了动物拟人化 虽然没有说话 但是动物本身的拟人化行为就代表着本质上还是一群不同人类的在面对灾难时的各种面貌 换成真人没太多不同
#SIFF#算是我的第一部上影节电影。画风是真的惊艳，全程没有一句台词，故事也是真的没什么故事。今年一种关注被动物电影充沛。,SIFF 算是我的第一部上影节电影 画风是真的惊艳 全程没有一句台词 故事也是真的没什么故事 今年一种关注被动物电影充沛
太好了，世界末日人类没了，太好了，猫还在。,太好了 世界末日人类没了 太好了 猫还在
不知为何，太像是一个影像化为主的游戏录屏了，也许是有场景、角色与情节的设置，但画面呈现好像其实没有视角,不知为何 太像是一个影像化为主的游戏录屏了 也许是有场景 角色与情节的设置 但画面呈现好像其实没有视角
老实讲不太喜欢拍动物硬要拟人和加隐喻的，关键是你故事讲明白了吗？其他动物不太懂，猫和狗的好多反应和动作设计感觉是凭着对这两种最常见宠物的刻板印象。卡皮巴拉除了是网红萌物，选择它作为主角的原因是什么？全片充斥刻意讨好和白人那种自以为深刻的单薄寓言，画面更是粗糙得像10年前的游戏CG。,老实讲不太喜欢拍动物硬要拟人和加隐喻的 关键是你故事讲明白了吗 其他动物不太懂 猫和狗的好多反应和动作设计感觉是凭着对这两种最常见宠物的刻板印象 卡皮巴拉除了是网红萌物 选择它作为主角的原因是什么 全片充斥刻意讨好和白人那种自以为深刻的单薄寓言 画面更是粗糙得像10年前的游戏CG
猫奴会心一笑，果然只有猫猫才能统治这个世界。,猫奴会心一笑 果然只有猫猫才能统治这个世界
"Oh，my captain！卡皮巴拉！真是让我们的船长操碎了心，又要开船，又要提醒猫猫避雨，还要给大家摘香蕉，给狐猴捡玻璃，协调“家庭矛盾”，你说说，操劳一个家庭是不是很辛苦！

狐猴🐒就是想照个镜子🪞，你就让它照嘛，干嘛老是破坏，还给人家整碎了，真是的！搜集那么多瓶瓶罐罐多不容易哇。

猫猫好，狗狗坏，有观众问导演为啥是猫？导演回答因为猫🐱怕水众人皆知，以及导演也养过猫。

至于电影的主题，大概率还是讲气候变暖洪水反复吧，所以最后他们又得继续奇幻漂流，但是其实不希望往这个有点儿陈旧乏味的方向去理解。以及相比《荒野机器人》，我更希望这部没有对白的电影能拿到奥斯卡最佳动画长片奖！",Oh my captain 卡皮巴拉 真是让我们的船长操碎了心 又要开船 又要提醒猫猫避雨 还要给大家摘香蕉 给狐猴捡玻璃 协调 家庭矛盾 你说说 操劳一个家庭是不是很辛苦 狐猴 就是想照个镜子 你就让它照嘛 干嘛老是破坏 还给人家整碎了 真是的 搜集那么多瓶瓶罐罐多不容易哇 猫猫好 狗狗坏 有观众问导演为啥是猫 导演回答因为猫 怕水众人皆知 以及导演也养过猫 至于电影的主题 大概率还是讲气候变暖洪水反复吧 所以最后他们又得继续奇幻漂流 但是其实不希望往这个有点儿陈旧乏味的方向去理解 以及相比 荒野机器人 我更希望这部没有对白的电影能拿到奥斯卡最佳动画长片奖
算了，跟你们不养猫的说不清楚。,算了 跟你们不养猫的说不清楚
感觉有些，说不清道不明的宗教意味和政治隐喻。无孩爱猫鹫，自我牺牲后，洪水褪却。环尾狐猴群体有等级和私有财产制度，群狗像乌合之众，水豚有种朴素的圣人感，还有水中神秘的天使大翅膀鲸鱼。平静的水面，小毛茸茸们第一次看清了自己。PS建模看起来挺廉价的&片尾有彩蛋,感觉有些 说不清道不明的宗教意味和政治隐喻 无孩爱猫鹫 自我牺牲后 洪水褪却 环尾狐猴群体有等级和私有财产制度 群狗像乌合之众 水豚有种朴素的圣人感 还有水中神秘的天使大翅膀鲸鱼 平静的水面 小毛茸茸们第一次看清了自己 PS建模看起来挺廉价的 片尾有彩蛋
猫猫救卡比吧啦猫好，拉布拉多保护猫猫狗好，卡比吧啦救小猴的玻璃球卡比吧啦好，蛇鹫为大家掌舵蛇鹫好，鲲救猫猫鲲好😭,猫猫救卡比吧啦猫好 拉布拉多保护猫猫狗好 卡比吧啦救小猴的玻璃球卡比吧啦好 蛇鹫为大家掌舵蛇鹫好 鲲救猫猫鲲好
美不胜收的动画佳作，对自然的呈现特别细腻。真实动物发出的各种声音取代了语言对白，在尊重动物习性的基础上只作了尽可能少的拟人化塑造（独立又机警的猫猫、或忠诚或无赖的狗狗、痴迷收藏品或自恋的狐猴、随遇而安的水豚、境界更高近乎分有神性的蛇鹫，还有神出鬼没的守护者巨鲸）。大量低机位运动长镜头效果，配上写实自然声与恰到好处配乐，沉浸感太足。天气效果逼真，山水风光秀丽，无论天朗气清、云销雨霁，还是细雨迷蒙甚或狂风暴雨，画面中的葱茏绿意、神秘遗迹、猫猫雕像、宏伟废都和幻彩极光都相当迷人。强度最高的一段审美体验，当属蛇鹫不断飞升而猫猫只能渐次落地的场景。整体上也是猫猫在遭遇洪水浩劫后不断历练成长、从独来独往到与其他动物互帮互助缔结友谊的过程。人类文明失落的世界观不加解释，与结尾都供人自由想象。（8.3/10）,美不胜收的动画佳作 对自然的呈现特别细腻 真实动物发出的各种声音取代了语言对白 在尊重动物习性的基础上只作了尽可能少的拟人化塑造 独立又机警的猫猫 或忠诚或无赖的狗狗 痴迷收藏品或自恋的狐猴 随遇而安的水豚 境界更高近乎分有神性的蛇鹫 还有神出鬼没的守护者巨鲸 大量低机位运动长镜头效果 配上写实自然声与恰到好处配乐 沉浸感太足 天气效果逼真 山水风光秀丽 无论天朗气清 云销雨霁 还是细雨迷蒙甚或狂风暴雨 画面中的葱茏绿意 神秘遗迹 猫猫雕像 宏伟废都和幻彩极光都相当迷人 强度最高的一段审美体验 当属蛇鹫不断飞升而猫猫只能渐次落地的场景 整体上也是猫猫在遭遇洪水浩劫后不断历练成长 从独来独往到与其他动物互帮互助缔结友谊的过程 人类文明失落的世界观不加解释 与结尾都供人自由想象 8 3 10
29th biff 1.动物设置一大堆很多其实都没什么意义。2.动物之间莫名其妙产生的情感不是很能理解。3.我想看最真实的动物世界下的一些东西，过分拟人化和引射人类社会下的东西为什么不直接让真人来演？4.很多逻辑和场景莫名其妙，没什么意义。5.全程观众笑的挺开心的，我在旁边挺尴尬的。,29th biff 1 动物设置一大堆很多其实都没什么意义 2 动物之间莫名其妙产生的情感不是很能理解 3 我想看最真实的动物世界下的一些东西 过分拟人化和引射人类社会下的东西为什么不直接让真人来演 4 很多逻辑和场景莫名其妙 没什么意义 5 全程观众笑的挺开心的 我在旁边挺尴尬的
#10443. #26th SIFF# 前入围2024戛纳一种关注。3.5。感觉是使用了游戏引擎或者游戏动画制作的技法，虚拟摄影机用出了很多非常有意思的长镜头，戛纳这种大电影节选是绝对没问题的。世界观不太完整或者说导演不是特别care在电影里铺世界观，这就导致影片能达到的高度有限了（但至少还有一个反人类中心主义的废土-神话叙事在）。黑猫真可爱，水豚更可爱。,10443 26th SIFF 前入围2024戛纳一种关注 3 5 感觉是使用了游戏引擎或者游戏动画制作的技法 虚拟摄影机用出了很多非常有意思的长镜头 戛纳这种大电影节选是绝对没问题的 世界观不太完整或者说导演不是特别care在电影里铺世界观 这就导致影片能达到的高度有限了 但至少还有一个反人类中心主义的废土 神话叙事在 黑猫真可爱 水豚更可爱
22/05🐈‍⬛从Animatic版本到Salle Debussy 我们的小猫终于游进了戛纳💙💙💙,22 05 从Animatic版本到Salle Debussy 我们的小猫终于游进了戛纳
确实看到了很多少年派的影子，令我难以共鸣的地方在于末日世界里的动物仍然表现出高度拟人和社会化的行为，那你跟会说话的动物卡通的区别在哪儿呢？审美风格上恰巧也是我没那么喜欢的 3D 风格，不过这个片子与其说本身对我有什么触动不如说制作过程对我的触动更大，小几十人的团队用 blender渲染两个月就搞完了… 以后再加上 AIGC 的加持，创作的技术与资金门槛肉眼可见的越来越低了,确实看到了很多少年派的影子 令我难以共鸣的地方在于末日世界里的动物仍然表现出高度拟人和社会化的行为 那你跟会说话的动物卡通的区别在哪儿呢 审美风格上恰巧也是我没那么喜欢的 3D 风格 不过这个片子与其说本身对我有什么触动不如说制作过程对我的触动更大 小几十人的团队用 blender渲染两个月就搞完了 以后再加上 AIGC 的加持 创作的技术与资金门槛肉眼可见的越来越低了
这是我今年看过最可爱的电影，导演一定养猫很多年，紧张的、开心的、害怕的、舒适的、玩耍的样子太像了！！！玩尾巴、从桌子上推东西、喜欢站在高处、玩光影、清洁自己，每一个猫的小习惯都捕捉到了，没有一句台词，却可爱晕了！少年喵的奇幻漂流，好美好可爱,这是我今年看过最可爱的电影 导演一定养猫很多年 紧张的 开心的 害怕的 舒适的 玩耍的样子太像了 玩尾巴 从桌子上推东西 喜欢站在高处 玩光影 清洁自己 每一个猫的小习惯都捕捉到了 没有一句台词 却可爱晕了 少年喵的奇幻漂流 好美好可爱
好聪明又勇敢的宝宝们。第一个泪点是水面上涨的时候猫猫不敢接受上船的邀请，因为自己不是狗狗们的一员，一种非常精准的孤独感。而最后的团体是由许多脱离了同类的动物们组成的。当白鹭飞往天空，它始终盯着的地方，那是一种令人心碎的高贵，意味着再没有同类的挽歌能给自己的灵魂立碑。绝对的自然是一个世界，现实是一个世界（最糟糕的），而电影传递的是幻想的世界，船在树上，树在风中，风在云上，云在水中。最后狐猴的镜子被打碎，但它也通过水中的倒影看清了自己。可惜的是开头那条努力向水中翻滚却又被猫猫叼走的鱼，没有人关心它去了哪，没有人关心这种最微不足道却又最庞然的生命力。幻想的世界始终受到现实世界的侵蚀。,好聪明又勇敢的宝宝们 第一个泪点是水面上涨的时候猫猫不敢接受上船的邀请 因为自己不是狗狗们的一员 一种非常精准的孤独感 而最后的团体是由许多脱离了同类的动物们组成的 当白鹭飞往天空 它始终盯着的地方 那是一种令人心碎的高贵 意味着再没有同类的挽歌能给自己的灵魂立碑 绝对的自然是一个世界 现实是一个世界 最糟糕的 而电影传递的是幻想的世界 船在树上 树在风中 风在云上 云在水中 最后狐猴的镜子被打碎 但它也通过水中的倒影看清了自己 可惜的是开头那条努力向水中翻滚却又被猫猫叼走的鱼 没有人关心它去了哪 没有人关心这种最微不足道却又最庞然的生命力 幻想的世界始终受到现实世界的侵蚀
高貴的動畫，看完之後你會覺得某些動畫如此聒噪,高貴的動畫 看完之後你會覺得某些動畫如此聒噪
这个建模有种想拿出游戏手柄的欲望 剧情其实很简单 很纯粹 视觉方面 退潮段落和最后鲸鱼的镜头给本人震撼挺大的,这个建模有种想拿出游戏手柄的欲望 剧情其实很简单 很纯粹 视觉方面 退潮段落和最后鲸鱼的镜头给本人震撼挺大的
没看懂想要表达什么，感觉就是一个很平淡很无趣的电影，在各种强行解读。,没看懂想要表达什么 感觉就是一个很平淡很无趣的电影 在各种强行解读
很好，奥斯卡用动画片主动交纳了猫税。只有我觉得白鹭的飞升，其实象征了死亡吗？她用翅膀奋力推开了猫猫，将之推出了灵魂上传的程式，使其意识苏醒，跌回了三维空间？暗喻她最后又一次救了猫猫？社恐又勇敢的猫猫当然很好，快乐小狗毫不设防、毫无保留的友爱与忠诚，也同样可贵。反正我已经在精神上大步流星提前奔小康，实现了两猫四狗的人生。然后永远敬佩着、向往着白鸟的高洁自由，与鲲的广阔。,很好 奥斯卡用动画片主动交纳了猫税 只有我觉得白鹭的飞升 其实象征了死亡吗 她用翅膀奋力推开了猫猫 将之推出了灵魂上传的程式 使其意识苏醒 跌回了三维空间 暗喻她最后又一次救了猫猫 社恐又勇敢的猫猫当然很好 快乐小狗毫不设防 毫无保留的友爱与忠诚 也同样可贵 反正我已经在精神上大步流星提前奔小康 实现了两猫四狗的人生 然后永远敬佩着 向往着白鸟的高洁自由 与鲲的广阔
五年前曾有幸选了Gints的长片首作Away在纽约首映，如今在戛纳的德彪西大厅看他的第二部作品，真是非常欣慰。尽管相比前作一个人搞定所有要肉眼可见的有钱、有人了很多，但依然保留了无对白风格，而以极具想象力与风格化的画面来展现这么一个独特版本的“大洪水与方舟”，配乐也是一如既往的出彩,五年前曾有幸选了Gints的长片首作Away在纽约首映 如今在戛纳的德彪西大厅看他的第二部作品 真是非常欣慰 尽管相比前作一个人搞定所有要肉眼可见的有钱 有人了很多 但依然保留了无对白风格 而以极具想象力与风格化的画面来展现这么一个独特版本的 大洪水与方舟 配乐也是一如既往的出彩
猫猫好！没有对白的动画非常考验制作团队的表现力，完成度很高，画面也有吸引力。不得不说这届戛纳一种关注有些片子比主竞赛的更像“给人看的”。,猫猫好 没有对白的动画非常考验制作团队的表现力 完成度很高 画面也有吸引力 不得不说这届戛纳一种关注有些片子比主竞赛的更像 给人看的
猫猫是你，水豚是你，狗狗是你，狐猴是你，蛇鹫和鲸鱼也是你。无助是你，善良是你，老实是你，自私是你，自尊和搁浅也是你。甚至洪水也是你。每一次无言的心情涌动，何尝不是一场洪水汹涌？,猫猫是你 水豚是你 狗狗是你 狐猴是你 蛇鹫和鲸鱼也是你 无助是你 善良是你 老实是你 自私是你 自尊和搁浅也是你 甚至洪水也是你 每一次无言的心情涌动 何尝不是一场洪水汹涌
真没人觉得有点恐怖吗？,真没人觉得有点恐怖吗
请后天拿奥斯卡（已拿，恭喜🎉）,请后天拿奥斯卡 已拿 恭喜
前三分之一，一直在想这个迷失有什么区别，把steam游戏搬上大银幕？后面我觉得这些想法都很幼稚。如果一个创作做到极致，足够好，它带给人的感受是不拘泥形式的。很喜欢最后，洪水退去大部分的动物得救，但对于鲸鱼是生命的终结。灾厄也是辩证的，唯一不变的是对生命的尊重。,前三分之一 一直在想这个迷失有什么区别 把steam游戏搬上大银幕 后面我觉得这些想法都很幼稚 如果一个创作做到极致 足够好 它带给人的感受是不拘泥形式的 很喜欢最后 洪水退去大部分的动物得救 但对于鲸鱼是生命的终结 灾厄也是辩证的 唯一不变的是对生命的尊重
