raw_content,cleaned_content
一艘船上的五只动物代表马斯洛需求的五个层次。水豚追求吃喝拉撒睡，是最基础的生理需求，也是小猫第一个同伴。狐猴代表安全需求，保护财产，避免威胁，但狐猴保卫的是一堆毫无价值的瓶瓶罐罐，他是二号同伴。三号是金毛狗，代表社交需要，无论是坏社交（狐朋狗友），还是好社交（与小猫），都是对爱和归属感的需要。然后是鹭鹰，对尊重的需要，人类理性中最高贵最接近神性的一部分。最后小猫则是自我实现的需求，它不断在大洪水和漂流中经历五个需求的变化，最后在拯救河豚的行动中完成自我。片中数次表现小猫落水，片尾它亦凝视水中倒影的自己。洪水代表潜意识，鲸鱼代表想象中自由的自我和搁浅时恐惧的自我，所有的自我需求都隐藏在潜意识的深水区里，等待下一次的潮起潮落。,一艘船上的五只动物代表马斯洛需求的五个层次 水豚追求吃喝拉撒睡 是最基础的生理需求 也是小猫第一个同伴 狐猴代表安全需求 保护财产 避免威胁 但狐猴保卫的是一堆毫无价值的瓶瓶罐罐 他是二号同伴 三号是金毛狗 代表社交需要 无论是坏社交 狐朋狗友 还是好社交 与小猫 都是对爱和归属感的需要 然后是鹭鹰 对尊重的需要 人类理性中最高贵最接近神性的一部分 最后小猫则是自我实现的需求 它不断在大洪水和漂流中经历五个需求的变化 最后在拯救河豚的行动中完成自我 片中数次表现小猫落水 片尾它亦凝视水中倒影的自己 洪水代表潜意识 鲸鱼代表想象中自由的自我和搁浅时恐惧的自我 所有的自我需求都隐藏在潜意识的深水区里 等待下一次的潮起潮落
人死光挺好的,人死光挺好的
没有这只拉布拉多，从此狗界低众生一等。@博纳大悦城SRIFF2024,没有这只拉布拉多 从此狗界低众生一等 博纳大悦城SRIFF2024
太美了太美了！人类死绝后的世界太美了！洪水灭世之少年猫的奇幻漂流，真正诠释了什么叫一个都不能少。导演用五年时间手绘自然奇观，每张截图都是屏保。想加入拜猫教…,太美了太美了 人类死绝后的世界太美了 洪水灭世之少年猫的奇幻漂流 真正诠释了什么叫一个都不能少 导演用五年时间手绘自然奇观 每张截图都是屏保 想加入拜猫教
在荒芜时代大洪水来临，化身为动物的“人类”向圣山漂流。被人类塑为地上灵性之神的猫，在神像顶端等来了诺亚之舟，孤身却常常惊惧的黑猫，孤身但情绪稳定的卡皮巴拉，和三只脱离群体的动物，虚荣自我的环尾狐猴，盲从的狗群中友善的金毛，叫板权威和宗族的鹭鹰。共同驶过文明的遗迹，所有船只都指向那同一个终点，水珠升腾，等待召唤，属于天的高洁之鸟羽化登仙，属于地灵的猫被凝结人类情感羁绊的玻璃球托起，顾虑蒙昧狗群的动物甚至没有登上圣山的机会，浮沉于人间又如何。洪水退却时环尾狐猴聚集在议事厅，推选新一任只看着自己的王，终究没有忘记共患难的情谊，终究只有独立的个体才能结伴更好的生存，鹿群是天命审判的灾厄象征，鲸是海中持剑又仁慈的天使。我们靠在一起看着倒影，我又是谁？,在荒芜时代大洪水来临 化身为动物的 人类 向圣山漂流 被人类塑为地上灵性之神的猫 在神像顶端等来了诺亚之舟 孤身却常常惊惧的黑猫 孤身但情绪稳定的卡皮巴拉 和三只脱离群体的动物 虚荣自我的环尾狐猴 盲从的狗群中友善的金毛 叫板权威和宗族的鹭鹰 共同驶过文明的遗迹 所有船只都指向那同一个终点 水珠升腾 等待召唤 属于天的高洁之鸟羽化登仙 属于地灵的猫被凝结人类情感羁绊的玻璃球托起 顾虑蒙昧狗群的动物甚至没有登上圣山的机会 浮沉于人间又如何 洪水退却时环尾狐猴聚集在议事厅 推选新一任只看着自己的王 终究没有忘记共患难的情谊 终究只有独立的个体才能结伴更好的生存 鹿群是天命审判的灾厄象征 鲸是海中持剑又仁慈的天使 我们靠在一起看着倒影 我又是谁
本以为是随大流的环保主题动画片，一点也不。上船，下船，再上船，再下船，重复着生和死的赌博。小黑猫从犹豫下水到数次落水，再到熟练捕鱼。反反复复，以至于都快对这一生死间的紧张感到麻木。白鹤可以为了小黑猫折断翅膀，它在此时已经选择了死亡。然而面对小狗同伴的求助，它为了活下去选择视而不见，但也注定了它必须要离开小船的命运。潮水退去，动物们回到熟悉的土地上。没有动物可以守护海洋中的守护者，只能见证鲸鱼在陆地上等待死亡。这是一个关于一艘理想主义小船在现实主义潮水中艰难前行的故事。,本以为是随大流的环保主题动画片 一点也不 上船 下船 再上船 再下船 重复着生和死的赌博 小黑猫从犹豫下水到数次落水 再到熟练捕鱼 反反复复 以至于都快对这一生死间的紧张感到麻木 白鹤可以为了小黑猫折断翅膀 它在此时已经选择了死亡 然而面对小狗同伴的求助 它为了活下去选择视而不见 但也注定了它必须要离开小船的命运 潮水退去 动物们回到熟悉的土地上 没有动物可以守护海洋中的守护者 只能见证鲸鱼在陆地上等待死亡 这是一个关于一艘理想主义小船在现实主义潮水中艰难前行的故事
大部分蠢材编剧都应该学学这部戏的编剧怎么去刻画剧情的，一句对白都没有，就是完全依靠小动物的行为去推动，而这个世界上很多蠢货编剧连90分钟的戏都驾驭不了，只会疯狂用没用的废话台词注水。,大部分蠢材编剧都应该学学这部戏的编剧怎么去刻画剧情的 一句对白都没有 就是完全依靠小动物的行为去推动 而这个世界上很多蠢货编剧连90分钟的戏都驾驭不了 只会疯狂用没用的废话台词注水
这个家没有卡皮巴拉迟早得散,这个家没有卡皮巴拉迟早得散
小猫为主角的末日公路片，把所有常见动物动画中的拟人塑造完全摒弃，不论是在本届展映还是近期院线中都是一股清流，如初夏的西瓜般解暑、利尿,小猫为主角的末日公路片 把所有常见动物动画中的拟人塑造完全摒弃 不论是在本届展映还是近期院线中都是一股清流 如初夏的西瓜般解暑 利尿
#SIFF26# 太喜欢了，今年上影节看得最喜欢的一部片子，小黑猫的奇幻漂流。镜头始终以低机位记录动物的神情，代入感很强，全程没有一句对白，但是完全把动物之间的交流展现的淋漓尽致，细腻动人，性格立体，又可爱又惊险。影片结尾，洪水退去，船开到了树上，似乎回到了片子一开头时的那个场景，就好像是一个轮回。白鸟注定属于天空，巨鲸必定畅游深海，而这些勇敢冒险的动物们，则属于广袤的陆地。所以我觉得这个片子在表明，不论时代如何变迁，是海洋时代还是陆地时代，每个个体都有它需要征服的旅程。同时片子并没有出现一个人类（仅有石像状的手），说明人类曾出现过，而动物们通过水面镜子等反射，看到了自己的面貌，也诞生了自我意识。所以片子似乎也在表达，去人类中心主义后的大自然，谁才是真正的主人。总之，小猫小狗就是坠吼的！,SIFF26 太喜欢了 今年上影节看得最喜欢的一部片子 小黑猫的奇幻漂流 镜头始终以低机位记录动物的神情 代入感很强 全程没有一句对白 但是完全把动物之间的交流展现的淋漓尽致 细腻动人 性格立体 又可爱又惊险 影片结尾 洪水退去 船开到了树上 似乎回到了片子一开头时的那个场景 就好像是一个轮回 白鸟注定属于天空 巨鲸必定畅游深海 而这些勇敢冒险的动物们 则属于广袤的陆地 所以我觉得这个片子在表明 不论时代如何变迁 是海洋时代还是陆地时代 每个个体都有它需要征服的旅程 同时片子并没有出现一个人类 仅有石像状的手 说明人类曾出现过 而动物们通过水面镜子等反射 看到了自己的面貌 也诞生了自我意识 所以片子似乎也在表达 去人类中心主义后的大自然 谁才是真正的主人 总之 小猫小狗就是坠吼的
人类还能拍出这样的片儿，说明也许还有救。,人类还能拍出这样的片儿 说明也许还有救
哈哈哈哈，这片子里猫很人、鹭鹰很人、卡皮巴拉很人、环尾狐猴很人，就金毛，怎么还那么狗啊。,哈哈哈哈 这片子里猫很人 鹭鹰很人 卡皮巴拉很人 环尾狐猴很人 就金毛 怎么还那么狗啊
"电影开头挂在树上的木船，暗示洪水涨退在不断重复。
这艘毛茸茸的诺亚方舟在淹没世界的洪水中漂出最温暖的涟漪。当蛇鹫振翅引发误会，狗狗护猫的笨拙让它终于读懂善意。后来它们在船头分食小鱼的画面，胜过千言万语的和解宣言。
狐猴执着收集玻璃器皿，却在接过水豚送来的镜子时，从反光中看见比收藏更珍贵的东西——伙伴眼里的星光。
导演把洪水灾难变成童话画布：鲸鱼脊背化作救生浮岛，蛇鹫在彩虹色云霞中羽化登仙，就连悬崖边众兽咬绳救船的惊险场面，都是萌态百出的集体表情包。
片尾彩蛋搁浅的鲸鱼摆尾重归大海，所有观众都会会心一笑——这个世界永远会给温柔的生命留扇后门。
猫猫教水豚划船，高冷的蛇鹫将球踢进水里，以及猫猫终于学会游泳后的傲娇模样，这些绒毛战士们用最本真的样子告诉我们：末日洪水冲不垮的，永远是互相托举的暖意。",电影开头挂在树上的木船 暗示洪水涨退在不断重复 这艘毛茸茸的诺亚方舟在淹没世界的洪水中漂出最温暖的涟漪 当蛇鹫振翅引发误会 狗狗护猫的笨拙让它终于读懂善意 后来它们在船头分食小鱼的画面 胜过千言万语的和解宣言 狐猴执着收集玻璃器皿 却在接过水豚送来的镜子时 从反光中看见比收藏更珍贵的东西 伙伴眼里的星光 导演把洪水灾难变成童话画布 鲸鱼脊背化作救生浮岛 蛇鹫在彩虹色云霞中羽化登仙 就连悬崖边众兽咬绳救船的惊险场面 都是萌态百出的集体表情包 片尾彩蛋搁浅的鲸鱼摆尾重归大海 所有观众都会会心一笑 这个世界永远会给温柔的生命留扇后门 猫猫教水豚划船 高冷的蛇鹫将球踢进水里 以及猫猫终于学会游泳后的傲娇模样 这些绒毛战士们用最本真的样子告诉我们 末日洪水冲不垮的 永远是互相托举的暖意
卡皮巴拉船长！敬礼！,卡皮巴拉船长 敬礼
一只小猫咪的末世冒险，以及如何和其它种类的动物共同生存，很容易想到那款叫Stray的游戏。叙事几乎全部依靠不同动物的真实特性和反应（甚至同类动物不同品种的不同性格，比如片中那只拉布拉多和其它狗狗的“表现”完全不一样），因此全片无对白，甚至把拟人化的笔触减至最低，也有极具想象力的段落设计。不过猫奴看得真心累，全程为大银幕上喵星人的冒险心惊胆战，每次它深陷险境不断喵喵叫，我脚趾都抓紧了，比看汤姆克鲁斯爬迪拜楼还紧张。,一只小猫咪的末世冒险 以及如何和其它种类的动物共同生存 很容易想到那款叫Stray的游戏 叙事几乎全部依靠不同动物的真实特性和反应 甚至同类动物不同品种的不同性格 比如片中那只拉布拉多和其它狗狗的 表现 完全不一样 因此全片无对白 甚至把拟人化的笔触减至最低 也有极具想象力的段落设计 不过猫奴看得真心累 全程为大银幕上喵星人的冒险心惊胆战 每次它深陷险境不断喵喵叫 我脚趾都抓紧了 比看汤姆克鲁斯爬迪拜楼还紧张
彩蛋最后还是给咱们大鲸鱼一个好结局了…不然我可得难受死😣,彩蛋最后还是给咱们大鲸鱼一个好结局了 不然我可得难受死
某些神性瞬间：鹫羽化成仙，鲸搁浅陆地。,某些神性瞬间 鹫羽化成仙 鲸搁浅陆地
"庞大的猫型雕塑证明猫是末日中的主角冒险者，狗是盲从但忠诚的愚者，狐猴是精致利己者，卡皮巴拉是善良有加但普通的庸人，蛇鹫是严肃古板的智者，鹿是感知厄运的通灵者，鲸是持剑守护万物生灵的天使
灾难到达顶峰时，悲观的智者放弃一切羽化登仙，只剩冒险者继续苦苦挣扎，被代表希望和文明的玻璃球托起，终于等到洪水退去，水位下降，曾经在天际翱翔的天使陨落，可通灵者表明灾难会再次来临，冒险者看着水中自己和同伴们的倒影，大概所有人心中都充满迷茫。彩蛋里鲸回到水中，可知洪水再次泛滥，那么冒险者呢？",庞大的猫型雕塑证明猫是末日中的主角冒险者 狗是盲从但忠诚的愚者 狐猴是精致利己者 卡皮巴拉是善良有加但普通的庸人 蛇鹫是严肃古板的智者 鹿是感知厄运的通灵者 鲸是持剑守护万物生灵的天使 灾难到达顶峰时 悲观的智者放弃一切羽化登仙 只剩冒险者继续苦苦挣扎 被代表希望和文明的玻璃球托起 终于等到洪水退去 水位下降 曾经在天际翱翔的天使陨落 可通灵者表明灾难会再次来临 冒险者看着水中自己和同伴们的倒影 大概所有人心中都充满迷茫 彩蛋里鲸回到水中 可知洪水再次泛滥 那么冒险者呢
不知为何联想到少年派的奇幻漂流甚至是七武士，也是某种公路片。献祭的圣人，狡猾的商人，憨厚靠谱的伙计，乐观的伙伴，扶持的老前辈，地痞流氓，面对类似末世灾难时如何一路成长。 类闯关RPG，同时自然类手持的晃动让画面生动不少。给大人看或许有些单调，但给小孩看又过于晦涩。,不知为何联想到少年派的奇幻漂流甚至是七武士 也是某种公路片 献祭的圣人 狡猾的商人 憨厚靠谱的伙计 乐观的伙伴 扶持的老前辈 地痞流氓 面对类似末世灾难时如何一路成长 类闯关RPG 同时自然类手持的晃动让画面生动不少 给大人看或许有些单调 但给小孩看又过于晦涩
简直是在演我，从开始对一切都怀有戒备心，到慢慢接纳，付出，有点后知后觉，却又不想留有遗憾，有些人错过了，有些人还在身边，有些人留在了回忆里。,简直是在演我 从开始对一切都怀有戒备心 到慢慢接纳 付出 有点后知后觉 却又不想留有遗憾 有些人错过了 有些人还在身边 有些人留在了回忆里
因为是大洪水寓言，动物的行为难免需要拟人化，但导演又不打算彻底的拟人化去塑造这些动物，现在这种做法会削弱叙事性，电影的定位其实是没什么娱乐性的文艺片。剧情在一个小时左右，当那几只狗狗上船之后，随着小猫的下船出走，之前船上动物之间建立的关系全部被打乱，可能性的冲突都被导演刻意回避掉了，随着大洪水的消退，电影也在头重脚轻的观感中快速结束了。,因为是大洪水寓言 动物的行为难免需要拟人化 但导演又不打算彻底的拟人化去塑造这些动物 现在这种做法会削弱叙事性 电影的定位其实是没什么娱乐性的文艺片 剧情在一个小时左右 当那几只狗狗上船之后 随着小猫的下船出走 之前船上动物之间建立的关系全部被打乱 可能性的冲突都被导演刻意回避掉了 随着大洪水的消退 电影也在头重脚轻的观感中快速结束了
这部片子最好的一点是：动物没有开口讲话。,这部片子最好的一点是 动物没有开口讲话
哪咤在这种片面前太幼稚了,哪咤在这种片面前太幼稚了
从一个人像一支队伍，到一个人组了一支队伍。,从一个人像一支队伍 到一个人组了一支队伍
2.0 / 或许人类最一厢情愿的人类中心想象就是：脱离（人类）语言就能远离人类中心主义。就像这部电影，世界观把非人类中心写在脸上，也有一些还算自觉的剧作细节，但是实际的叙事逻辑和推进效果，完完全全是把神话重写变成小学语文考试看图编故事……,2 0 或许人类最一厢情愿的人类中心想象就是 脱离 人类 语言就能远离人类中心主义 就像这部电影 世界观把非人类中心写在脸上 也有一些还算自觉的剧作细节 但是实际的叙事逻辑和推进效果 完完全全是把神话重写变成小学语文考试看图编故事
可能是我缺乏点对哲学与萌物的感悟，全片看完的感触只是一丝淡淡的疑惑：这是在做什么？,可能是我缺乏点对哲学与萌物的感悟 全片看完的感触只是一丝淡淡的疑惑 这是在做什么
猫猫是intp，白鸟是infj，金毛是enfp，狐猴是esfj，卡皮巴拉是rest,猫猫是intp 白鸟是infj 金毛是enfp 狐猴是esfj 卡皮巴拉是rest
影片是厌人症患者的福音，但讽刺的是影院里叽叽喳喳的幼童又扰乱了这一切。,影片是厌人症患者的福音 但讽刺的是影院里叽叽喳喳的幼童又扰乱了这一切
"3.5；以人类痕迹几乎已消除的大洪水时期为背景，透过一只猫的视角，去目睹大地变形、日月变色，画面绝美，动画形式的长镜头如入无人之境（整体框架有游戏的闯关设定），落入深海的幽闭恐惧症爆发。
五种不同性格/意识的动物集结于诺亚方舟，朝着天际线方向的山巅进发——可隐喻为寻找文明和生息的历程，期间更遭遇过狗群上船后的地盘抢夺，但导演并未往这个方向深挖，点到为止后重点落到动物们自我意识的觉醒并为共存共生而作出努力，可能这才是“陆上行舟”坠落之后它们看向水中影子的共同想法，而曾是水中世界守护者的鲸鱼，承载着从濒临死亡而复生的希望，游向开阔明朗的应许之地。
最爱白鹭羽化登仙一段，迷离如梦境，动物群体中最具反叛意识的先行者，必将最先获得自由；而留在尘世的猫猫，成长为智慧和勇气的生灵。",3 5 以人类痕迹几乎已消除的大洪水时期为背景 透过一只猫的视角 去目睹大地变形 日月变色 画面绝美 动画形式的长镜头如入无人之境 整体框架有游戏的闯关设定 落入深海的幽闭恐惧症爆发 五种不同性格 意识的动物集结于诺亚方舟 朝着天际线方向的山巅进发 可隐喻为寻找文明和生息的历程 期间更遭遇过狗群上船后的地盘抢夺 但导演并未往这个方向深挖 点到为止后重点落到动物们自我意识的觉醒并为共存共生而作出努力 可能这才是 陆上行舟 坠落之后它们看向水中影子的共同想法 而曾是水中世界守护者的鲸鱼 承载着从濒临死亡而复生的希望 游向开阔明朗的应许之地 最爱白鹭羽化登仙一段 迷离如梦境 动物群体中最具反叛意识的先行者 必将最先获得自由 而留在尘世的猫猫 成长为智慧和勇气的生灵
非电影。,非电影
抱着我喵看的，它没坚持多久，可能因为我一直在说看看人家，看看人家,抱着我喵看的 它没坚持多久 可能因为我一直在说看看人家 看看人家
有意思，不会因为我们是同类就真的是同类。每个人都有自己的人生课题，独立并不意味着孤独，合作也并不意味着同流。有些人只能一起走一段，也有些人会随时离开。充满哲思的flow。,有意思 不会因为我们是同类就真的是同类 每个人都有自己的人生课题 独立并不意味着孤独 合作也并不意味着同流 有些人只能一起走一段 也有些人会随时离开 充满哲思的flow
没朋友，找朋友，丢朋友，好朋友。,没朋友 找朋友 丢朋友 好朋友
边看边怕他们饿着,边看边怕他们饿着
从始至终感受着来自猫猫身上难以言说的哀伤。,从始至终感受着来自猫猫身上难以言说的哀伤
为小镜子反射的光点发狂，被水上的漂浮小球救起。狐猴在四处搜罗，鹭鹰在争夺领地，野犬在到处狂吠，水豚在安然休憩。末日里的小动物们在努力求生，从陆地换成方舟不过是另一种栖居。到山顶去看天，到水底去赏鱼，会有孤鸟在船尾把持方向，会有巨鲸从海底拯救万灵。洪水吞没人类文明，留下希声的遗迹。,为小镜子反射的光点发狂 被水上的漂浮小球救起 狐猴在四处搜罗 鹭鹰在争夺领地 野犬在到处狂吠 水豚在安然休憩 末日里的小动物们在努力求生 从陆地换成方舟不过是另一种栖居 到山顶去看天 到水底去赏鱼 会有孤鸟在船尾把持方向 会有巨鲸从海底拯救万灵 洪水吞没人类文明 留下希声的遗迹
洪水对猫来说是灾难，干旱对鱼来说是灾难。万物共生，潮涨潮落，猫学会了自我献祭，却看不懂天道轮回。真的是一部非常奇妙的电影，简单的寓言却饱含深意，像极了我们的人生。入选年度前十,洪水对猫来说是灾难 干旱对鱼来说是灾难 万物共生 潮涨潮落 猫学会了自我献祭 却看不懂天道轮回 真的是一部非常奇妙的电影 简单的寓言却饱含深意 像极了我们的人生 入选年度前十
大虐！大虐！狗狗身败名裂！,大虐 大虐 狗狗身败名裂
诺亚方舟，末世寓言。如果你是没有什么坏心眼的小猫咪🐈‍⬛，全世界都会帮你❤️。每种动物的特性都抓得极准，很难不爱！/ SIFF 2024 第4场@美罗城,诺亚方舟 末世寓言 如果你是没有什么坏心眼的小猫咪 全世界都会帮你 每种动物的特性都抓得极准 很难不爱 SIFF 2024 第4场 美罗城
不知为何，太像是一个影像化为主的游戏录屏了，也许是有场景、角色与情节的设置，但画面呈现好像其实没有视角,不知为何 太像是一个影像化为主的游戏录屏了 也许是有场景 角色与情节的设置 但画面呈现好像其实没有视角
猫好！卡皮巴拉好！长腿鸟好！狗好！狐猴好！鲲好！喵的一声，猫学会了游泳；喵的一声，猫学会了捉鱼。人做出这样的片子，人也好。,猫好 卡皮巴拉好 长腿鸟好 狗好 狐猴好 鲲好 喵的一声 猫学会了游泳 喵的一声 猫学会了捉鱼 人做出这样的片子 人也好
导演真是精神东方人。白鸟和鲸鱼的设定好庄子啊。北冥有鱼，其名为鲲。鲲之大，不知其几千里也。化而为鸟，其名为鹏。鹏之背，不知其几千里也。白鸟羽化补天，一鲸落万物生。,导演真是精神东方人 白鸟和鲸鱼的设定好庄子啊 北冥有鱼 其名为鲲 鲲之大 不知其几千里也 化而为鸟 其名为鹏 鹏之背 不知其几千里也 白鸟羽化补天 一鲸落万物生
"没有人类，没有对白，只有动物们在洪水吞没的世界里寻找新的栖息方式。在危险与静谧中，有神性升腾而起。西方的城市、东方的庙宇，还有那些高耸入云的山峦，让人分不清时空。独立而充满戒备的猫，乐观无戒心的狗，处乱不惊的水豚，圣洁又孤傲的蛇鹫，以及那只有收集癖的狐猴，它想靠奇珍异宝吸引同类，但实则不过是举着镜子孤芳自赏——像极了困在社交媒体中的人。

这显然是个可做各种解读的隐喻文本，后疫情、环保主义、移民……总之关于如何被迫与他者找到和谐共处的方式。但也可做最单纯的观看，它仅仅关于一个后人类世界，动物们如何从“大逃杀”想象中生还，重新回到自然之中。水是天劫，也是孕育重生的母体。",没有人类 没有对白 只有动物们在洪水吞没的世界里寻找新的栖息方式 在危险与静谧中 有神性升腾而起 西方的城市 东方的庙宇 还有那些高耸入云的山峦 让人分不清时空 独立而充满戒备的猫 乐观无戒心的狗 处乱不惊的水豚 圣洁又孤傲的蛇鹫 以及那只有收集癖的狐猴 它想靠奇珍异宝吸引同类 但实则不过是举着镜子孤芳自赏 像极了困在社交媒体中的人 这显然是个可做各种解读的隐喻文本 后疫情 环保主义 移民 总之关于如何被迫与他者找到和谐共处的方式 但也可做最单纯的观看 它仅仅关于一个后人类世界 动物们如何从 大逃杀 想象中生还 重新回到自然之中 水是天劫 也是孕育重生的母体
太好了，世界末日人类没了，太好了，猫还在。,太好了 世界末日人类没了 太好了 猫还在
大洪水之后人类都死绝了吧。就…可不可以不要在小动物身上投射一整套人类社会的生存法则和价值观，真的不想做阅读理解。你们人类太容易自作多情了！,大洪水之后人类都死绝了吧 就 可不可以不要在小动物身上投射一整套人类社会的生存法则和价值观 真的不想做阅读理解 你们人类太容易自作多情了
